{
  "introduction": "<p>AI coding assistants have revolutionized software development, offering unprecedented productivity gains and creative problem-solving capabilities. However, their integration into development workflows introduces <strong>seven principal risks</strong> that can compromise security, quality, and maintainability if not properly managed. These risks span from security vulnerabilities and logic flaws to data leakage, licensing violations, maintainability issues, bias propagation, and over-reliance concerns.</p><p>This collection addresses these challenges through a <em>risk-mitigation focused approach</em>, organizing resources by their ability to help developers safely harness AI assistance while preserving code quality and security standards. Each resource is evaluated on a 1-100 scale across the seven risk dimensions, with selection prioritized by <strong>highest individual risk area scores</strong> to ensure practical applicability over generic guidance.</p><p>The resources provide actionable strategies, proven frameworks, and battle-tested practices that enable teams to maximize AI coding benefits while maintaining professional development standards and mitigating potential risks.</p>",
  "resources": [
    {
      "type": "Article",
      "title": "Secure AI-Assisted Development: A Comprehensive Security Framework",
      "source": "https://owasp.org/www-project-ai-security-and-privacy-guide/",
      "risk_coverage": {
        "security_vulnerabilities": 95,
        "code_quality": 80,
        "data_privacy": 85,
        "licensing_ip": 70,
        "maintainability": 75,
        "bias_standards": "not_covered",
        "over_reliance": "not_covered"
      },
      "overall_score": 88,
      "highest_score": 95,
      "coverage_breadth": 5,
      "weeks_on_list": 1,
      "blurb": "OWASP's comprehensive framework for securing AI-assisted development with detailed vulnerability mitigation strategies and security testing approaches."
    },
    {
      "type": "Article",
      "title": "GitHub Copilot Security Best Practices",
      "source": "https://docs.github.com/en/copilot/managing-copilot/managing-copilot-as-an-individual-subscriber/reviewing-your-security-logs-for-copilot",
      "risk_coverage": {
        "security_vulnerabilities": 90,
        "code_quality": 75,
        "data_privacy": 85,
        "licensing_ip": 80,
        "maintainability": 65,
        "bias_standards": "not_covered",
        "over_reliance": 70
      },
      "overall_score": 82,
      "highest_score": 90,
      "coverage_breadth": 6,
      "weeks_on_list": 1,
      "blurb": "Official GitHub documentation covering security logging, data handling, and best practices for safe Copilot usage in enterprise environments."
    },
    {
      "type": "Article",
      "title": "NIST AI Risk Management Framework",
      "source": "https://www.nist.gov/itl/ai-risk-management-framework",
      "risk_coverage": {
        "security_vulnerabilities": 85,
        "code_quality": 80,
        "data_privacy": 90,
        "licensing_ip": 75,
        "maintainability": 70,
        "bias_standards": 85,
        "over_reliance": 75
      },
      "overall_score": 80,
      "highest_score": 90,
      "coverage_breadth": 7,
      "weeks_on_list": 1,
      "blurb": "Comprehensive federal framework for managing AI risks including bias detection, privacy protection, and governance strategies for development teams."
    },
    {
      "type": "Article",
      "title": "Microsoft Responsible AI Standard for Developers",
      "source": "https://www.microsoft.com/en-us/ai/responsible-ai",
      "risk_coverage": {
        "security_vulnerabilities": 80,
        "code_quality": 75,
        "data_privacy": 85,
        "licensing_ip": 70,
        "maintainability": 80,
        "bias_standards": 90,
        "over_reliance": 75
      },
      "overall_score": 79,
      "highest_score": 90,
      "coverage_breadth": 7,
      "weeks_on_list": 1,
      "blurb": "Microsoft's comprehensive standard for responsible AI development with specific guidance on bias mitigation and ethical coding practices."
    },
    {
      "type": "Book",
      "title": "AI-Assisted Programming: Better Planning, Coding, Testing, and Deployment",
      "source": "https://www.oreilly.com/library/view/ai-assisted-programming/9781098164556/",
      "risk_coverage": {
        "security_vulnerabilities": 85,
        "code_quality": 90,
        "data_privacy": 75,
        "licensing_ip": 80,
        "maintainability": 85,
        "bias_standards": 70,
        "over_reliance": 80
      },
      "overall_score": 81,
      "highest_score": 90,
      "coverage_breadth": 7,
      "weeks_on_list": 1,
      "blurb": "Comprehensive guide covering quality assurance, testing frameworks, and validation strategies for AI-generated code with practical implementation examples."
    },
    {
      "type": "Article",
      "title": "Copilot IP and Licensing Considerations",
      "source": "https://github.blog/2021-06-30-github-copilot-research-recitation/",
      "risk_coverage": {
        "security_vulnerabilities": "not_covered",
        "code_quality": "not_covered",
        "data_privacy": 75,
        "licensing_ip": 90,
        "maintainability": "not_covered",
        "bias_standards": "not_covered",
        "over_reliance": "not_covered"
      },
      "overall_score": 75,
      "highest_score": 90,
      "coverage_breadth": 2,
      "weeks_on_list": 1,
      "blurb": "GitHub's official research on code recitation rates and intellectual property implications of AI-generated code with compliance recommendations."
    },
    {
      "type": "Article",
      "title": "Software Composition Analysis for AI-Generated Code",
      "source": "https://snyk.io/learn/application-security/software-composition-analysis-sca/",
      "risk_coverage": {
        "security_vulnerabilities": 85,
        "code_quality": 70,
        "data_privacy": "not_covered",
        "licensing_ip": 90,
        "maintainability": 65,
        "bias_standards": "not_covered",
        "over_reliance": "not_covered"
      },
      "overall_score": 76,
      "highest_score": 90,
      "coverage_breadth": 4,
      "weeks_on_list": 1,
      "blurb": "Comprehensive guide to using SCA tools for detecting licensing violations and security vulnerabilities in AI-generated code dependencies."
    },
    {
      "type": "Article",
      "title": "Static Analysis Security Testing (SAST) for AI Code",
      "source": "https://semgrep.dev/blog/2023/ai-generated-code-security/",
      "risk_coverage": {
        "security_vulnerabilities": 90,
        "code_quality": 80,
        "data_privacy": "not_covered",
        "licensing_ip": "not_covered",
        "maintainability": 70,
        "bias_standards": "not_covered",
        "over_reliance": "not_covered"
      },
      "overall_score": 78,
      "highest_score": 90,
      "coverage_breadth": 3,
      "weeks_on_list": 1,
      "blurb": "Semgrep's approach to securing AI-generated code through automated static analysis with specific rules for common AI-introduced vulnerabilities."
    },
    {
      "type": "Article",
      "title": "Enterprise AI Coding Assistant Privacy Guide",
      "source": "https://docs.aws.amazon.com/codewhisperer/latest/userguide/data-protection.html",
      "risk_coverage": {
        "security_vulnerabilities": 75,
        "code_quality": "not_covered",
        "data_privacy": 90,
        "licensing_ip": 70,
        "maintainability": "not_covered",
        "bias_standards": "not_covered",
        "over_reliance": "not_covered"
      },
      "overall_score": 72,
      "highest_score": 90,
      "coverage_breadth": 3,
      "weeks_on_list": 1,
      "blurb": "AWS CodeWhisperer's comprehensive data protection and privacy framework for enterprise AI coding assistant deployment."
    },
    {
      "type": "Blog",
      "title": "Code Review Best Practices for AI-Generated Code",
      "source": "https://martinfowler.com/articles/ai-assisted-programming.html",
      "risk_coverage": {
        "security_vulnerabilities": 80,
        "code_quality": 90,
        "data_privacy": "not_covered",
        "licensing_ip": 65,
        "maintainability": 85,
        "bias_standards": 75,
        "over_reliance": 80
      },
      "overall_score": 79,
      "highest_score": 90,
      "coverage_breadth": 6,
      "weeks_on_list": 1,
      "blurb": "Martin Fowler's comprehensive analysis of code review practices specifically adapted for AI-generated code with quality validation frameworks."
    },
    {
      "type": "Article",
      "title": "Testing Strategies for AI-Generated Code",
      "source": "https://testingbot.com/blog/testing-ai-generated-code",
      "risk_coverage": {
        "security_vulnerabilities": 75,
        "code_quality": 90,
        "data_privacy": "not_covered",
        "licensing_ip": "not_covered",
        "maintainability": 80,
        "bias_standards": 70,
        "over_reliance": "not_covered"
      },
      "overall_score": 76,
      "highest_score": 90,
      "coverage_breadth": 4,
      "weeks_on_list": 1,
      "blurb": "Comprehensive testing methodologies for validating AI-generated code including edge case detection and automated quality assurance pipelines."
    },
    {
      "type": "Article",
      "title": "Maintaining Code Quality with AI Assistants",
      "source": "https://stackoverflow.blog/2023/04/26/why-you-should-be-skeptical-of-ai-generated-code/",
      "risk_coverage": {
        "security_vulnerabilities": 70,
        "code_quality": 85,
        "data_privacy": "not_covered",
        "licensing_ip": "not_covered",
        "maintainability": 90,
        "bias_standards": 75,
        "over_reliance": 85
      },
      "overall_score": 78,
      "highest_score": 90,
      "coverage_breadth": 5,
      "weeks_on_list": 1,